,id_enterprise,enterprise_name,job_name,city,job_description,hierarchy_level,job_type,functions,sectors
64,13610,Accor,Développeur Talend Big Data H/F,"Évry, Île-de-France, France","     Qui sommes-nous ?      Chez Accor, nous osons réinventer l’hospitalité non pas comme un lieu, mais comme une suite infinie de moments connectés où chacun est libre de vivre, travailler et se divertir.  Pour transformer le Groupe et créer cette Hospitalité Augmentée, nous recherchons des techs passionnés et avides de challenges !    En tant qu’expert technique et partenaire business de confiance, notre département I.T. a pour ambition de concevoir et mettre en œuvre une plateforme SI ouverte, agile et performante pour accompagner le groupe dans sa transformation.       Quel environnement ?       Au sein de la Direction Information Technology, la direction Data Intelligence met en œuvre des projets BI, Analytics et Big Data, tout en assurant le support niveau 3 des applications en place.   Ses principales missions sont de collecter les données du groupe Accor, de les transformer et restituer la valeur aux différents métiers du groupe et particulièrement Hôtels, Régions et Guest. Sensible à la protection des données personnelles, à la gouvernance et au monitoring de la data, son chantier primordial consiste à garantir une qualité optimum des données et de ses applicatifs. Pour la réussite de ses projets, l’équipe Data Intelligence travaille également en étroite collaboration avec différentes directions IT, à savoir : Architecture, Sécurité, Production etc …      Rejoignez cette nouvelle aventure tech !     Quel sera votre rôle ?     En pleine mutation vers les nouvelles fonctionnalités des environnements CLOUD (Amazon AWS, Google GCP …) vous amènerez toute votre expertise à la mise en place de solutions Bi et Analytics dans un environnement industriel en relation étroite avec l'ensemble des acteurs du projet.  Vous travaillerez avec différents partenaires comme les experts métier de la donnée, les data analystes mais également les dev-ops et la sécurité. Vous serez au cœur du programme de la plate-forme mondiale Welcome DATA.  Cette plate-forme est aujourd’hui composée d’un Datalake hybride Cloudera hébergé chez AWS, son DatawareHouse Snowflake, et d’un Lab autour du Dataïku. Référent technique et garant de la qualité durable, votre travail consiste à réaliser les développements des traitements DWH, des modèles de données et des rapports BI.     Qui êtes-vous ?       Développeur.se expérimenté.e, vous maitrisez les technologies Talend et Talend Big Data depuis 2 ans minimum. Expert dans le Datalake vous savez intégrer et en extraire des données.  Vous avez déjà travaillé dans un environnement AGILE et en maitrisez les outils et les méthodologies.     Comme les compétences techniques ne suffisent pas chez nous, vous êtes également un excellent communiquant, aimant le travail en équipe et le mode collaboratif.     De plus, si votre niveau d’anglais vous permet de communiquer sans problème dans un contexte international, ce poste est pour vous !     Prêt.e à relever ce challenge ? Contactez-nous !     Technologies en bref :      Indispensables : ETL / Talend / SQL / Modélisation / Restitution Microstrategy - Mooc CNIL GDPR Les petits plus : Snowflake   Localisation du poste : Evry",Premier emploi,Temps plein,['Technologies de l’information'],"['Restauration collective', 'Commerce de détail', 'Hôtellerie et hébergement']"
65,13611,Urban Linker,Développeur Fullstack Python,"Lyon, FR","Cette startup ne cesse de grandir et conquérir de nouveaux marchés, c’est pourquoi elle recherche aujourd’hui son prochain développeur pour l’accompagner dans cette croissance. L’équipe R&D de la startup ne cesse de chercher des solutions innovantes pour améliorer son service.PosteAvec l’accompagnement d’un lead developer, tu participeras à la conception de nouvelles fonctionnalités et l’amélioration continue de leur plateforme.Selon ton niveau d’expériences et tes compétences, tu pourras aussi être amené à développer sur la partie frontend et mobile.Stack techno : Nécessaire : Python / Django ou Flask ; PostGreSQL.Petit plus si : Connaissances en Angular et/ou IonicPackage38 à 45K selon expérience + avantages (mutuelle, tickets resto, transports)Les +Ouvert sur le remoteIntéressementBureaux superbesÉquipe Multiculturelle et accueillanteQue tu sois un développeur junior avec déjà une première expérience professionnelle ou plus confirmé, ce poste peut te correspondre ! L’équipe est prête à te faire monter en compétence rapidement, si besoin, dans le respect des bonnes pratiques de code !Tu es capable d’échanger correctement en anglais et surtout, tu adoooooores Python !Si tu t’es reconnu, alors n’hésites plus et postule !DATA ANALYST JUNIOR | FINTECH | PARIS CENTREParis, FranceFintech en pleine internationalisation cherche son Data Analyst junior !DevOps Ruby AWS Senior (H/F)Paris, FranceStartup qui n’a pas peur de bousculer le marché, dans le secteur du recrutement, recherche un DevOps Ruby pour migrer sur le Cloud !Key Account Manager (H/F)Paris, FranceSi tu souhaites intégrer une Start-up innovante en pleine croissance, fonce !13.02.2019UI/UX Designer: deux métiers proches, mais si différents",Premier emploi,Temps plein,"['Ingénierie', 'Technologies de l’information']","['Technologies et services de l’information', 'Logiciels informatiques', 'Internet']"
66,13612,Intrum-fr,DATA ANALYST H/F,"Saint-Priest, FR","Description du posteDans le cadre d'un remplacement de congé maternité, au sein de notre pôlePerformance opérationnelle, vous serez en charge de deux principalesMissionsParticiper activement à la mise en place de nouvelles méthodes de travailde business Intelligence & data analytics.En effet, le Groupe a pour objectif de transformer ses méthodes de travailpar l’utilisation d’outils de Business Intelligence dans le cadre d’unprojet d’envergure internationale. Pour ce faire, vous serez en charge dela création des rapports ( besoins utilisateurs, meilleurs KPI, efficienced’accès à la donnée, et présentation des rapports ).Acteur clef à l’issue du déploiement, en lien avec les équipes groupe pourla maintenance et l’évolution des reporting mis en œuvre, en lien avec lesdifférents utilisateurs / clients internes.Avoir en particulier la mission d’optimiser la performance opérationnellesur le périmètre « Rachats de Créances », en coordination avec le portfoliomanager France.Projection des encaissements du service « Rachats de créances »Participation à la création et la mise à jour de reporting d’activitéPréparation de la réunion mensuelle du service (bilan et objectifs)Analyse de la performance des portefeuilles de créancesAnalyse & Optimisation des processus de recouvrement dans leur globalitéProfil recherchéDe formation bac +4/5 avec une spécialisation en statistiques / économétrie/ Informatique décisionnelle, vous avez une première expérience sur unefonction similaire.Vous êtes en capacité d’analyser et de synthétiser des données. Pour cefaire, vous avez une excellente maîtrise des outils informatiques et de BI( Qlikview, ...).Des relations régulières avec les équipes internationales sont prévues,votre niveau d'anglais doit donc être impérativement courant (parlé etécrit).Force de proposition, vous travaillerez en étroite collaboration avecdifférents services. Votre excellent relationnel vous permettra doncd'avoir un bonne communication et une bonne coordination dans unfonctionnement transversal. Vous avez l’esprit d’équipe.Et enfin, vous êtes autonome, curieux(se), organisé(e) et rigoureux(se).Autres informationsPourquoi choisir Intrum ?Un positionnement privilégié au cœur du Parc Technologique de Saint Priest(à 35mn de Lyon Centre et de Bourgoin-Jallieu)L’intégration dans un groupe international avec des possibilités decarrières dans 24 paysPartager cette offreMentions légalesDonnées personnelles",Premier emploi,Temps plein,['Technologies de l’information'],"['Avocats', 'Banques', 'Services juridiques']"
67,13613,Urban Linker,Développeur Python Django sénior,"Lyon, FR","Cette PME innovante est en pleine croissance, c’est pourquoi elle recherche aujourd’hui son prochain développeur pour l’accompagner. L’équipe R&D ne cesse de chercher des solutions innovantes pour améliorer son servicePosteAvec ton équipe tech, tu participeras à la conception de nouvelles fonctionnalités et l’amélioration continue de leur plateforme.Tes Missions Seront Participer à l’écriture des spécifications fonctionnelles Rédiger les spécifications techniques avant l’implémentation Implémenter les nouvelles fonctionnalités Corriger les anomalies Relire le code des autres membres Stack technnique : Python / DjangoPetit plus si connaissances enIntégration continue : Github, Gitlab, Jenkins, CI/CDPackage 35 à 40K + avantages (mutuelle, tickets restaurants, prime d’intéressement) Les +Ouvert sur le remote à temps partielBureaux superbesÉquipe Multiculturelle et accueillanteQue tu sois un développeur junior ou plus confirmé, ce poste peut te correspondre ! L’équipe est prête à te faire monter en compétence rapidement, si besoin, dans le respect des bonnes pratiques de code !Tu es capable d’échanger correctement en anglais et surtout, tu adoooooores Python !Si tu t’es reconnu, alors n’hésites plus et postule !Développeur Python / DjangoLyon, FranceUne expérience enrichissante dans une startup en plein croissance, ça t’intéresse ?DEVELOPPEUR SENIOR PHP7 SYMFONY3 #BRAS DROIT DU CTO #STARTUPParis, FranceChallenge international sur un secteur pas encore discrupté, avec pour mentor un CTO de renommée. Que demander de + ? Allez, clique pour en savoir (...)Développeur backend node.js (H/F)Paris, FranceRejoins la start-up qui maximise le potentiel commercial de chaque entreprise grâce au digital !12.08.2016Développeur: Comment définir votre projet avant l'entretien ?",Confirmé,Temps plein,"['Ingénierie', 'Technologies de l’information']","['Technologies et services de l’information', 'Logiciels informatiques', 'Internet']"
68,13614,Carriere-info.fr,Analyste fonctionnel informatique Senior Salesforce,"Lyon, FR","SIDERLOG Conseil est un cabinet de conseil basé à Lyon, Nantes, Niort et Paris qui intervient au cur des projets SI de sociétés grands comptes.Nos Domaines D’intervention Sont Les Suivants Organisation et conduite du changement Management de projet SI et AMOA Décisionnel, Data & DigitalPour accompagner un de nos clients grand compte, nous recherchons un Consultant AMOA Business Analyst Senior.Il devra prendre en charge les activités suivantes :Rédaction et mise à jour de spécifications fonctionnelles détailléesRédaction des cahiers de testsRéalisation des tests fonctionnelsConfiguration Salesforce standard (création d’objets / workflows / process builders) et avancée (Flows & correction de Class APEX)Animation de workshops métierSuivi du développement en relation avec une équipe offshoreCertifications ObligatoiresCertification Salesforce Administrateur (ADM201)Certifications RecommandéesCertification App BuilderSkillsMaîtrise de la configuration générale de la plateforme Salesforce (Profile, Permission sets, custom settings, custom labels, custom metadata type)Maîtrise des processus Salesforce standard de modification automatiques des données (Workflows, Flows, Process builder)Maîtrise du modèle de données standard Salesforce et des outils d’analyses (workbench, salesforce inspector)Connaissances des bases développement Salesforce (Apex class / Visualforce / Batch / Triggers)Capacité de proposition de solutions techniques à implémenter en accord avec les architectes du ProgrammeSoftskillsAnglais obligatoireExpérience de travail avec des équipes offshoreBonne gestion de la coordinationÊtre force de proposition",Confirmé,Temps plein,['Technologies de l’information'],"['Technologies et services de l’information', 'Réseaux informatiques', 'Sécurité informatique et des réseaux']"
69,13615,Adsearch SAS,Data analyst h/f,"Limonest, FR","Le cabinet Adsearch IT recrute pour un de ses clients basé dans l'ouest Lyonnais un DATA ANALYST SENIOR (h/f)Spécialiste de la DATA, vous intégrez une nouvelle équipe afin d'accompagner des entreprises et les marques sur toutes les étapes du parcours client.Vos Missions Réalisation d'études ad hoc sur les comportements clients. Mettre en œuvre les leviers statistiques décisionnels pour la conduite et l'analyse des programmes de marketing relationnels et de stimulation des acteurs de ventes. Etre force de conseil, proposer et présenter des restitutions chiffrées, synthétiques et efficaces.Nous recherchons une personne ayant un réel esprit d'équipe, vous êtes rigoureux et pédagogue.Vous maîtrisez parfaitement le langage SQL et l'un des principaux logiciels statistiques (SAS, R, Spark, …)Vous avez entre 5 et 8 années d'expérienceDiplômé(e) d'une formation (BAC +5) statistiques, base de données, informatique décisionnelleLE PROFILE RECHERCHÉNous recherchons une personne ayant un réel esprit d'équipe, vous êtes rigoureux et pédagogue.Vous maîtrisez parfaitement le langage SQL et l'un des principaux logiciels statistiques (SAS, R, Spark, …)Vous avez entre 5 et 8 années d'expérienceDiplômé(e) d'une formation (BAC +5) statistiques, base de données, informatique décisionnelleL'ENTREPRISEAdsearch, cabinet de recrutement du Groupe Adéquat, recrute en France et à l'international des profils d'experts techniques et de cadres pour ses clients. Spécialisés dans leur domaine, nos dénicheurs de talents vous accompagnent tout au long de votre carrière. Adsearch, simplement pour vous !Retrouvez toutes nos offres sur www.adsearch.fr",Premier emploi,Temps plein,['Technologies de l’information'],"['Technologies et services de l’information', 'Recrutement ', 'Ressources humaines']"
70,13616,TLScontact,Head of Products & Partnerships H/F Lyon 3,"Lyon, Auvergne-Rhône-Alpes, France","The Head of Products & Partnerships will manage TLScontact’s evolving Product team, and play a critical role in optimising our current product and service portfolio and capitalising on the significant growth opportunity this area represents. You will actively seek to develop profitable new products, partnerships, and services that enhance and add value to our core visa process outsourcing activity. The new Head of Products and Partnerships (HPP) will be a strong negotiator with advanced partner development skills and significant experience of managing the product and service lifecycle from conception to maturity.Activities·        Strategy & Roadmap Developmento   Develop and refine the overall Product strategy with the Product & Marketing Director.o   Work with the Product Manager to develop and validate individual roadmaps for the optimisation of current products and the development of new products and partnerships aligned to specific user groups.o   Take responsibility for the full product lifecycle, ensuring current products and services are optimised and there is a qualified pipeline of new products in development to meet commercial and operational needs. ·        Product & Partner Developmento   Own the relationship with current and potential service partners, third party vendors, and channel partners who are critical to delivering services within the portfolio.o   Identify, research, engage, and negotiate with potential partners who can help TLScontact develop an innovative, compelling and profitable portfolio of added value products to meet the needs of our government clients and end-users.o   Liaise with key stakeholders within the business to drive specific initiatives and opportunities, including Client Directors, the Bid Director and Operational leads.o   Work with the wider Product team to implement pilot projects and establish MVP trials for products entered into the roadmap.o   Map the product pipeline against viable markets and audiences to identify regional gaps where bespoke product development activity should be undertaken.·        Product Leadershipo   Be the ambassador for Product within the organisation, using a continuous improvement mindset to continually look for opportunities to work with operations, regional teams and country managers to increase product sales and profitability.o   Form strong and collaborative relationships with organisational units that play a crucial role in the product lifecycle, including IT, legal, data protection and security.o   Liaise with Client Directors to ensure products entering the development phase are in line with client objectives, contractual obligations, and account strategy. ·        Analysis & Reviewo   With the support of the Product Marketing Manager and the Product & Marketing Analyst, create financial models and business cases to support the development of individual products and the realisation of department objectives.o   Track and report product development progress against the roadmap and key milestones, along with financial performance for products and services post-launch.Your Profile : ·        7+ years product and/or service development experience required, which may include partner development activity, channel development or a direct involvement in building successful strategic alliances.·        Experience of developing individual services that are managed as products would be beneficial, although candidates with experience working across software or other industries are encouraged to apply.·        Distinct sales or business development experience will be an advantage.·        The ideal candidate will have a combination of both B2C and B2B/B2G experience, although strong candidates on either side are encouraged to apply.·        Ideal industry experience would include any combination of:o   B2B/B2G business process outsourcing, software, IT solutionso   B2C travel services, citizen services for public sector organisations·        Candidates with experience of working in large, complex organisations that operate across multiple global locations will be preferred, but this will not exclude candidates with differing backgrounds.Knowledge·        Strong experience in product / service management and development.·        Significant experience of identifying, engaging and negotiating with partners and third-party vendors in order to build a product or service offering.·        Knowledge of developing product roadmaps, managing backlog, product prioritisation, and the product lifecycle.·        Any specific experience and knowledge of visa, travel and citizen services will be an advantage.·        Any experience of government outsourcing and foreign affairs will be of significant benefit.Capabilities·        Negotiation and business development skills.·        Strong research and analytical skills.·        Excellent written and verbal communication skills.·        Project management and organisational skills.·        A skilled collaborator, capable of working with diverse teams and negotiating complex processes.·        Ability to manage multiple projects – with expert organisational skills.Attitude·        Commercial sense·        Assertive and curious self-starter·        Able to work independently and without close supervision·        Able to build effective interpersonal working relationships across the organisation,·        Able to understand complex situations and to adapt / react to unforeseen circumstances.",Manager,Temps plein,"['Développement commercial ', 'Responsable produit', 'Commerce']","['Externalisation/délocalisation', 'Services aux consommateurs', 'Services d’investissement']"
71,13617,Micropole,Chef de projets Master Data Management H/F,"Villeurbanne, FR","Groupe international spécialisé en conseil et technologies innovantes, Micropole recrute un Chef de Projets MDM.Acteurs incontournables sur les sujets de gouvernance des données, les collaborateurs Micropole Rhône-Alpes participent activement à la croissance et au rayonnement de l’agence.Au quotidien, en tant que spécialistes de l’intégration des principaux outils du marché, ils accompagnent des clients de tous secteurs d’activité dans la mise en œuvre de leurs référentiels afin de fiabiliser et valoriser leurs données.Vos MissionsEn charge d’une équipe organisée en mode agile ou classique, vous êtes l’interface entre nos clients, les développeurs et les autres membres du dispositif projet. Vous intervenez sur le pilotage des différentes phases d’un projet en assurant la qualité des livrables ainsi que la bonne gestion du planning et du budget associés. Vous assurez le suivi et vous êtes garant de l’occupation des équipes pour assurer un dispositif opérationnel (suivi de staffing, suivi des tableaux de bord et des indicateurs...) Vous pratiquez une activité de reporting, de remontée et d’alerte auprès de votre hiérarchie et / ou des autres équipes impactées par le projet. Vous intervenez sur la conception, la modélisation générale et détaillée, l’élaboration et l’exécution des plans d’amélioration et de mise en cohérence des données et la rédaction des normes business. Vous pouvez également participer activement aux avant-ventes : chiffrage, réponse à appel d’offres, rédaction des réponses techniques et fonctionelles, évaluation des charges, soutenance. Votre ProfilA l’aise avec l’encadrement d’équipe et l’animation de projets au forfait et en régie, vos expériences passées vous ont amené à mettre en avant votre capacité à intégrer des problématiques fonctionnelles complexes, à analyser les risques et à être force de propositions.De formation supérieure, vous avez au moins 4 ans d’expérience professionnelle en conduite de projets soit : BI avec des expériences en data quality et des aptitudes en modélisation transactionnelle. Web avec des expériences en modélisation de processus métiers. Ou vous avez une première expérience réussie en tant que Business Analyst et vous souhaitez évoluer vers de la chefferie de projet.Vous avez l’habitude de travailler avec des solutions progicialisées. La maîtrise des concepts des référentiels de données (MDM) est un plus.Enfin, vous souhaitez rejoindre une entité dynamique dans laquelle les collaborateurs portent l’esprit d’équipe et travaillent sur des projets innovants.Micropole croit en ses talents et les accompagne dans leur montée en compétences pour être toujours au niveau des exigences du marché.Avec notre plateforme Micropole Learning Solutions. Devenez acteur de votre carrière, Join the #InnovativePeople team !Pour candidater, merci d’envoyer votre CV à : recrutement.lyon@micropole.com Réf : 2019-BAMDM-RA",Manager,Temps plein,"['Management de projet', 'Technologies de l’information']","['Technologies et services de l’information', 'Logiciels informatiques', 'Internet']"
